{
  "$schema": "https://json-schema.org/draft/2020-12/schema",
  "$id": "https://batvault.dev/schemas/bundles.view.json",
  "title": "Bundle (View)",
  "type": "object",
  "additionalProperties": false,
  "properties": {
    "response.json": { "$ref": "./bundles.exec_summary.json" },
    "trace.json":    { "$ref": "./bundles.trace.json" },
    "receipt.json":  { "$ref": "./receipt.json" },
    "bundle.manifest.json": { "$ref": "./bundle.manifest.json" }
  },
  "required": ["response.json", "trace.json", "receipt.json", "bundle.manifest.json"]
}