{"bundle.manifest.json":"{\"artifacts\":[{\"bytes\":1818,\"content_type\":\"application/json\",\"name\":\"evidence_canonical.json\",\"sha256\":\"af6c048cccaf981d6e600b466bfff5dfb66c25a02d6612603d5c2dc67ee69060\"},{\"bytes\":1924,\"content_type\":\"application/json\",\"name\":\"evidence_post.json\",\"sha256\":\"0d9b0d2d012e84e31da3c593afc18d95db6605c3169945cab0429c1981ae596f\"},{\"bytes\":1818,\"content_type\":\"application/json\",\"name\":\"evidence_pre.json\",\"sha256\":\"af6c048cccaf981d6e600b466bfff5dfb66c25a02d6612603d5c2dc67ee69060\"},{\"bytes\":144,\"content_type\":\"application/json\",\"name\":\"gateway.plan.json\",\"sha256\":\"89ac6f9d09a3fe6e2b25c8fb65a164b767d58d88785f52f9eb8e9cc0b098536a\"},{\"bytes\":255,\"content_type\":\"application/json\",\"name\":\"receipt.json\",\"sha256\":\"719b38d927d0eeddeb8f04e8a327980f92efca0c32e3f9a201152659385b5e0b\"},{\"bytes\":2303,\"content_type\":\"application/json\",\"name\":\"response.json\",\"sha256\":\"0f1cb1fcdc7424d34767e8c44c9ddf76956ceba55df6f3c4200018aabbeb40a3\"},{\"bytes\":954,\"content_type\":\"application/json\",\"name\":\"trace.json\",\"sha256\":\"b40f59d7ab7711fefe15b42313fb83c1a81b050d39d06567697eb532d43fc08d\"}]}","receipt.json":"{\"alg\":\"ed25519\",\"covered\":\"sha256:8426d5ed423149665f5786b274cf8176807a493603860a755822012a68d1c6e0\",\"key_id\":\"gateway/k1\",\"sig\":\"SNDbu1enkLtCRnB40Z6qSo+Hu8QP/8ZogApx98jSejxO1U8MpMWDIAv0u0tVcOJNkELMQ1Q62DfV66lU6WsSCw==\",\"signed_at\":\"2025-11-02T16:55:15Z\"}","response.json":"{\"response\":{\"anchor\":{\"decision_maker\":{\"id\":\"org:vp-eng\",\"name\":\"Sam Rivera\",\"org\":\"Engineering\",\"role\":\"VP Engineering\"},\"description\":\"Select and integrate Stripe to support EU billing and VAT handling for the Q4 launch.\",\"domain\":\"eng\",\"id\":\"eng#d-eng-010\",\"timestamp\":\"2025-08-15T10:00:00Z\",\"title\":\"Adopt Stripe for EU billing\",\"type\":\"DECISION\",\"x-extra\":{\"anchor\":\"eng#eng_d-eng-010\",\"okr\":\"FY25: EU Launch\",\"sensitivity\":\"medium\",\"tags\":[\"billing\",\"eu\",\"stripe\"]}},\"answer\":{\"blocks\":{\"decision_id\":\"eng#d-eng-010\",\"description\":\"Select and integrate Stripe to support EU billing and VAT handling for the Q4 launch\",\"key_events\":[\"eng#e-eng-002\",\"eng#e-eng-001\"],\"lead\":\"Sam Rivera on 2025-08-15: Adopt Stripe for EU billing.\",\"next\":\"eng#d-eng-011\",\"owner\":{\"name\":\"Sam Rivera\",\"role\":\"VP Engineering\"}},\"cited_ids\":[\"eng#d-eng-010\",\"eng#e-eng-002\",\"eng#e-eng-001\",\"eng#d-eng-011\"]},\"completeness_flags\":{\"event_count\":3,\"has_preceding\":true,\"has_succeeding\":true},\"graph\":{\"edges\":[{\"from\":\"sales#e-sales-alias-eng-010\",\"timestamp\":\"2025-08-18T09:00:00Z\",\"to\":\"eng#d-eng-010\",\"type\":\"ALIAS_OF\"},{\"from\":\"eng#d-eng-010\",\"orientation\":\"succeeding\",\"timestamp\":\"2025-09-05T09:30:00Z\",\"to\":\"eng#d-eng-011\",\"type\":\"CAUSAL\"},{\"from\":\"eng#e-eng-001\",\"orientation\":\"preceding\",\"timestamp\":\"2025-08-13T10:00:00Z\",\"to\":\"eng#d-eng-010\",\"type\":\"LED_TO\"},{\"from\":\"eng#e-eng-002\",\"orientation\":\"preceding\",\"timestamp\":\"2025-08-14T12:00:00Z\",\"to\":\"eng#d-eng-010\",\"type\":\"LED_TO\"},{\"from\":\"sales#e-sales-alias-eng-010\",\"orientation\":\"succeeding\",\"timestamp\":\"2025-08-20T14:05:00Z\",\"to\":\"sales#d-sales-005\",\"type\":\"LED_TO\"}]},\"meta\":{\"allowed_ids\":[\"eng#d-eng-010\",\"eng#d-eng-011\",\"eng#e-eng-001\",\"eng#e-eng-002\",\"sales#d-sales-005\",\"sales#e-sales-alias-eng-010\"],\"allowed_ids_fp\":\"sha256:8c41cb030648bd44354284aac439e5708e46f771c79b1292fca6f0508abb5f1d\",\"budget_cfg_fp\":\"\",\"bundle_fp\":\"sha256:8426d5ed423149665f5786b274cf8176807a493603860a755822012a68d1c6e0\",\"fingerprints\":{\"graph_fp\":\"sha256:7e9154d24b2ce3177d0844484e200ed4fcfb45279674f8ef511224864f10831a\"},\"policy_fp\":\"sha256:f7c9ff03622df11bd215e80781bc068896a134d04662413c8fdb9009fc805014\",\"selector_policy_id\":\"sim_desc__ts_iso_desc__id_asc\",\"snapshot_etag\":\"b05e347ee4add0fe7f24fd5429a4dcd1dc57f59107def984758bb0e54c4a2830\"}},\"schema_version\":\"v3\"}","trace.json":"{\"gateway_path\":{\"bundle_fp\":\"sha256:8426d5ed423149665f5786b274cf8176807a493603860a755822012a68d1c6e0\",\"events_ranked_top3\":[\"sales#e-sales-alias-eng-010\",\"eng#e-eng-002\",\"eng#e-eng-001\"],\"orientation_counts\":{\"preceding\":2,\"succeeding\":2},\"selector_policy_id\":\"sim_desc__ts_iso_desc__id_asc\",\"templater\":{\"mode\":\"deterministic\",\"template_version\":\"v3-blocks\"},\"validation\":{\"error_count\":0}},\"request\":{\"anchor_id\":\"eng#d-eng-010\",\"intent\":\"why_decision\",\"request_id\":\"c9c22e20d96b4a69\",\"trace_id\":null,\"ts_utc\":\"2025-11-02T16:55:15Z\"},\"response_preview\":{\"blocks\":{\"decision_id\":\"eng#d-eng-010\",\"description\":\"Select and integrate Stripe to support EU billing and VAT handling for the Q4 launch\",\"key_events\":[\"eng#e-eng-002\",\"eng#e-eng-001\"],\"lead\":\"Sam Rivera on 2025-08-15: Adopt Stripe for EU billing.\",\"next\":\"eng#d-eng-011\",\"owner\":{\"name\":\"Sam Rivera\",\"role\":\"VP Engineering\"}},\"completeness_flags\":{\"event_count\":3,\"has_preceding\":true,\"has_succeeding\":true}},\"validator\":{}}"}